Authors,Link	
McGlone M.S., Hall G.M.J., Wilmshurst J.M.,	https://www.scopus.com/inward/record.uri?eid=2-s2.0-79957657110&partnerID=40&md5=225a00be2bc00adcd69f874f0ab959c2
Klein G.L., Drury J.L., Pfaff M.S.,	https://www.scopus.com/inward/record.uri?eid=2-s2.0-79956091068&partnerID=40&md5=68acfb79dc949302c657f75ed2b3a310
Gonzalez C., Madhavan P.,	https://www.scopus.com/inward/record.uri?eid=2-s2.0-79959333256&partnerID=40&md5=656203e407c1acc92aae6e69cbaafbde
Lin C., Wu E.M.-Y., Lee C.-N., Kuo S.-L.,	https://www.scopus.com/inward/record.uri?eid=2-s2.0-79955602733&partnerID=40&md5=a50a1d8579d6b7cc42e8853c34b6777b
Ebbels T.M., Lindon J.C., Coen M.,	https://www.scopus.com/inward/record.uri?eid=2-s2.0-79953754310&partnerID=40&md5=d4ef5b45fcba7b1cd163c237286f37ff
Reza B., Sadiq R., Hewage K.,	https://www.scopus.com/inward/record.uri?eid=2-s2.0-78650858064&partnerID=40&md5=8dd3dcdb1835e37072d93d5a6a748c87
Grüne-Yanoff T.,	https://www.scopus.com/inward/record.uri?eid=2-s2.0-79955712510&partnerID=40&md5=8556e6720cf4cfd8b6d57e246adcdec9
Kasaei S.H., Kasaei S.M., Kasaei S.A., Monadjemi S.A.,	https://www.scopus.com/inward/record.uri?eid=2-s2.0-79952381731&partnerID=40&md5=0d7a0749b6669eaa9025f1b6d529f54a
Lee S.,	https://www.scopus.com/inward/record.uri?eid=2-s2.0-78651378384&partnerID=40&md5=991427e0e681031b6076ebcfcef10068
Murphy C., Bastola S., Hall J., Harrigan S., Murphy N., Holman C.,	https://www.scopus.com/inward/record.uri?eid=2-s2.0-84857959240&partnerID=40&md5=e3964495e1ce01285b7e0827699ecda7
Zeeb F.D., Winstanley C.A.,	https://www.scopus.com/inward/record.uri?eid=2-s2.0-79951540364&partnerID=40&md5=0d0f33880565599342de9a41ae57c5a8
Zhao X., Lei Y.-L., Li Q., Zhu Y.-F.,	https://www.scopus.com/inward/record.uri?eid=2-s2.0-79954457123&partnerID=40&md5=2358f6c872ab34ab00097440b413c016
Stevenson M., Pandor A.,	https://www.scopus.com/inward/record.uri?eid=2-s2.0-78751636549&partnerID=40&md5=71eae3f7f7d200963bce38ec8b9fcf01
Liu Y., Moon S.P., Pfaff M.S., Drury J.L., Klein G.L.,	https://www.scopus.com/inward/record.uri?eid=2-s2.0-84905647841&partnerID=40&md5=f016983d8ee9f06e9645a7991b0eecd0
Matrosov E.S., Woods A., Harou J.J., Zhou K.,	https://www.scopus.com/inward/record.uri?eid=2-s2.0-84906237335&partnerID=40&md5=a4693078af7536e8628f9fb302334a63
Korteling B., Dessai S., Kapelan Z.,	https://www.scopus.com/inward/record.uri?eid=2-s2.0-84906231482&partnerID=40&md5=ca8b0e8808d2fece294e00017d47f736
[No author name available],	https://www.scopus.com/inward/record.uri?eid=2-s2.0-78650618421&partnerID=40&md5=c65e58a84558df0d2149955dfcb18a1b
Maxwell P., Maciejewski A.A., Siegel H.J., Potter J.,	https://www.scopus.com/inward/record.uri?eid=2-s2.0-78650600645&partnerID=40&md5=83f2f46c4dfab4ce11419b36d7eb94ef
Castiglia P., Singh A., Hoffpauir R., Mishra S., Lavenue M., Norvell S.,	https://www.scopus.com/inward/record.uri?eid=2-s2.0-84874257707&partnerID=40&md5=e63949bfbd6390faff15d5e3fa90cc08
Stakhiv E.Z.,	https://www.scopus.com/inward/record.uri?eid=2-s2.0-79551510840&partnerID=40&md5=788303ff7bac57b9ba8443610c0ca1dc
Scala N.M., Needy K.L., Rajgopal J.,	https://www.scopus.com/inward/record.uri?eid=2-s2.0-84880485039&partnerID=40&md5=82c93441a18308a367b83bb1dce50aab
Dieckmann C.A.,	https://www.scopus.com/inward/record.uri?eid=2-s2.0-84877880043&partnerID=40&md5=a8cd803d97740e1c8548ea4b88b5b02b
Grebici K., Hisarciklilar O., Thomson V.,	https://www.scopus.com/inward/record.uri?eid=2-s2.0-80055012476&partnerID=40&md5=a0e46b9afdbee03244f9f3817d20770b
Comes T., Hiete M., Wijngaards N., Schultmann F.,	https://www.scopus.com/inward/record.uri?eid=2-s2.0-79952094876&partnerID=40&md5=3bacc72672bd472ca3bf169e20188a19
Ermoliev Y., Makowski M., Marti K.,	https://www.scopus.com/inward/record.uri?eid=2-s2.0-79960067343&partnerID=40&md5=da59feaff76f3b0f09beddd251b8d924
Sathian B., Bhatt C.R., Jayadevan S., Ninan J., Baboo N.S., Sandeep G.,	https://www.scopus.com/inward/record.uri?eid=2-s2.0-78650687364&partnerID=40&md5=b39ac3ad8885befdcf627087746b3d3e
Gober P., Wentz E.A., Lant T., Tschudi M.K., Kirkwood C.W.,	https://www.scopus.com/inward/record.uri?eid=2-s2.0-79953285776&partnerID=40&md5=5fa594cd22343d0e83a77bbc68551e71
Böschen S., Kastenhofer K., Rust I., Soentgen J., Wehling P.,	https://www.scopus.com/inward/record.uri?eid=2-s2.0-77957280570&partnerID=40&md5=7dd34bbc52528e727a3b4a16ec055955
Gulpinar N., Canakoglu E., Thoms J.,	https://www.scopus.com/inward/record.uri?eid=2-s2.0-77958504511&partnerID=40&md5=304636d0d0da8027a7f2275f6d364a16
Liu F.,	https://www.scopus.com/inward/record.uri?eid=2-s2.0-77955863451&partnerID=40&md5=947c7d099201b62c42ecb5ab47db45d0
Arnold T.W.,	https://www.scopus.com/inward/record.uri?eid=2-s2.0-77955084450&partnerID=40&md5=eece44a58b97672f3acb12e70198c16a
Lempert R.J., Groves D.G.,	https://www.scopus.com/inward/record.uri?eid=2-s2.0-77953809303&partnerID=40&md5=d67b50426e9ce1f685b56bee974de374
Wang C.-H., Min K.J.,	https://www.scopus.com/inward/record.uri?eid=2-s2.0-77956546408&partnerID=40&md5=4e48d70d22d0feb6177e5314dafdea60
Charru M., Seynave I., Morneau F., Bontemps J.-D.,	https://www.scopus.com/inward/record.uri?eid=2-s2.0-77954951922&partnerID=40&md5=f20d9ac5aabbe0888da6a18a8ecd9b41
Kapoor R., Furby J., Hayton T., Smith K.J., Altmann D.R., Brenner R., Chataway J., Hughes R.A., Miller D.H.,	https://www.scopus.com/inward/record.uri?eid=2-s2.0-77953476309&partnerID=40&md5=1a5ba85d94212e01cfbb6bb7a4131353
Francis R.A., Goodman M.K.,	https://www.scopus.com/inward/record.uri?eid=2-s2.0-77950594372&partnerID=40&md5=7f052fb6569286ef29337e693f14fb0d
Le Q.B., Park S.J., Vlek P.L.G.,	https://www.scopus.com/inward/record.uri?eid=2-s2.0-77950690162&partnerID=40&md5=77a81fd3682321558cd1c6774290d7b8
Zacksenhouse M., Bogacz R., Holmes P.,	https://www.scopus.com/inward/record.uri?eid=2-s2.0-77949873882&partnerID=40&md5=02c6edfa8d2d5b511b50ea8d1320b219
Lee S.,	https://www.scopus.com/inward/record.uri?eid=2-s2.0-77950357192&partnerID=40&md5=d040772a72967a0b47e90e6a15af8bf7
Puretskiy A.A., Shutt G.L., Berry M.W.,	https://www.scopus.com/inward/record.uri?eid=2-s2.0-81355125697&partnerID=40&md5=d66506525cef01b182e418e2e051d96e
Azadeh A., Shirkouhi S.N., Rezaie K.,	https://www.scopus.com/inward/record.uri?eid=2-s2.0-77249177511&partnerID=40&md5=181e2d99e8209812410197bdc4569c0e
Levine P., Pearlman J.,	https://www.scopus.com/inward/record.uri?eid=2-s2.0-77249103506&partnerID=40&md5=e98ea8c1ccb42ceb96b8742bda566e9c
Isendahl N., Dewulf A., Pahl-Wostl C.,	https://www.scopus.com/inward/record.uri?eid=2-s2.0-77949267653&partnerID=40&md5=7a36dc4dd363d431233d846bd877a3ab
Massoudieh A., Crain C., Lambertini E., Nelson K.E., Barkouki T., L'Amoreaux P., Loge F.J., Ginn T.R.,	https://www.scopus.com/inward/record.uri?eid=2-s2.0-76349093369&partnerID=40&md5=11791cd5f07b61c6bec641c0cd247e16
Yilmaz L., Mitchell B.,	https://www.scopus.com/inward/record.uri?eid=2-s2.0-84885494892&partnerID=40&md5=b451df4e46acfe35f0796b3227adfa74
Joffe S., Truog R.D.,	https://www.scopus.com/inward/record.uri?eid=2-s2.0-84888289822&partnerID=40&md5=0c905d1c2102048b20cc9db159495009
Lempert R.J., Popper S.W., Bankes S.C.,	https://www.scopus.com/inward/record.uri?eid=2-s2.0-73549103383&partnerID=40&md5=20651e9c4895dae5cbe303b078297cb3
Mathieu J., Pfaff M., Klein G., Drury J., Geodecke M., James J., Mahoney P., Bobashev G.,	https://www.scopus.com/inward/record.uri?eid=2-s2.0-84905657026&partnerID=40&md5=8dd7ce4f031805deacedd741d13ac6ca
Bryant B.P., Lempert R.J.,	https://www.scopus.com/inward/record.uri?eid=2-s2.0-72149099073&partnerID=40&md5=113648699b02bbb73e89635feb54084f
Repperger D.W., Warm J.S., Vidulich M.A., Finomore V.S.,	https://www.scopus.com/inward/record.uri?eid=2-s2.0-74849114261&partnerID=40&md5=e4361ec890570edbc89753e9be83e276
Flamos A., Roupas C.V., Psarras J.,	https://www.scopus.com/inward/record.uri?eid=2-s2.0-79955696502&partnerID=40&md5=44b83bf08105cd5b324d8c65cd132300
Ancori B.,	https://www.scopus.com/inward/record.uri?eid=2-s2.0-77953601592&partnerID=40&md5=f8b25ce316e2f469dfe2e4f0c92538b2
Talton J.O., Gibson D., Yang L., Hanrahan P., Koltun V.,	https://www.scopus.com/inward/record.uri?eid=2-s2.0-77749271055&partnerID=40&md5=3e279f8777fcf5c7acc26c3bb63ba97f
Ting S., Chilukuri M.V.,	https://www.scopus.com/inward/record.uri?eid=2-s2.0-70449858780&partnerID=40&md5=27e6b2c9d6793d431257be2f21bc7612
Khalsa A.S., Boyd H., Slocum D.,	https://www.scopus.com/inward/record.uri?eid=2-s2.0-70349956418&partnerID=40&md5=2920d57f26f7d47e3f1c79a38fcbe026
Grossmann I.,	https://www.scopus.com/inward/record.uri?eid=2-s2.0-70449931818&partnerID=40&md5=4cfde941feddceaaef16a7b16f4e4be4
Agusdinata D.B., Van Der Pas J.W.G.M., Walker W.E., Marchau V.A.W.J.,	https://www.scopus.com/inward/record.uri?eid=2-s2.0-70349631880&partnerID=40&md5=6bfe45780efffe47f405295b1bfa1902
Besseris G.J.,	https://www.scopus.com/inward/record.uri?eid=2-s2.0-70349204503&partnerID=40&md5=fadad4c4b2c6cb6acb98d641fa6c3b3c
Lempert R., Scheffran J., Sprinz D.F.,	https://www.scopus.com/inward/record.uri?eid=2-s2.0-70349729861&partnerID=40&md5=1107de78ea2b53827592719f7b5e82c9
Ben-Haim Y., Zacksenhouse M., Keren C., Dacso C.C.,	https://www.scopus.com/inward/record.uri?eid=2-s2.0-67349218863&partnerID=40&md5=7f26f2059ac0d873dbc4fa08ceb70356
Zhang W., Wu H., Liu J., Zhu Y.-F., Li Q.,	https://www.scopus.com/inward/record.uri?eid=2-s2.0-68249114454&partnerID=40&md5=20ac427e768505c0751669cfb8082db5
Jammernegg W., Kischka P.,	https://www.scopus.com/inward/record.uri?eid=2-s2.0-61449152039&partnerID=40&md5=76c5b816b2971c2cc6b9d6a7fc6c7f6b
Rustem B., Howe M.,	https://www.scopus.com/inward/record.uri?eid=2-s2.0-84890618828&partnerID=40&md5=0e4e485f647f07ecf1aea1ca42bd5433
Patterson R., Pierce B., Bell H.H., Andrews D., Winterbottom M.,	https://www.scopus.com/inward/record.uri?eid=2-s2.0-84993708274&partnerID=40&md5=50704514287efcf7d147fb26b50c9f92
Drury J.L., More L., Pfaff M., Klein G.L.,	https://www.scopus.com/inward/record.uri?eid=2-s2.0-84905592116&partnerID=40&md5=a20ea784ac0ead2f56c17a9db0a62449
Di Domenica N., Lucas C., Mitra G., Valente P.,	https://www.scopus.com/inward/record.uri?eid=2-s2.0-58149231456&partnerID=40&md5=19b6a900d6efb87433a5458bda924e7e
Zarghami M., Szidarovszky F.,	https://www.scopus.com/inward/record.uri?eid=2-s2.0-59149091411&partnerID=40&md5=0c9d62ae95ba5c940ba71fc090acc38f
Karsak E.E., Özogul C.O.,	https://www.scopus.com/inward/record.uri?eid=2-s2.0-54049101718&partnerID=40&md5=48f2f568a177fcdf7c55168baf235df4
Stimson R.J., Robson A., Shyy T.-K.,	https://www.scopus.com/inward/record.uri?eid=2-s2.0-67349141790&partnerID=40&md5=8d36b4221781d3d8633383041c99f62d
Mazid A.Md., Islam M.F.,	https://www.scopus.com/inward/record.uri?eid=2-s2.0-58049129060&partnerID=40&md5=2542d657c8dad77db3b7a6cd0c1c5fa9
Bell S., Aitken V.,	https://www.scopus.com/inward/record.uri?eid=2-s2.0-57149129963&partnerID=40&md5=ed39a356de4753a6c4326106bb6d61b5
Grebici K., Goh Y.M., McMahon C.,	https://www.scopus.com/inward/record.uri?eid=2-s2.0-84861482420&partnerID=40&md5=aef9cff5c552898131306be60d475433
Wojtowicz R.L.,	https://www.scopus.com/inward/record.uri?eid=2-s2.0-58149117935&partnerID=40&md5=47ffb122491ed23dd7cf713763fa50e6
McDonald-Madden E., Baxter P.W.J., Possingham H.P.,	https://www.scopus.com/inward/record.uri?eid=2-s2.0-54349084124&partnerID=40&md5=9a674aec0d013466dc9e95ce7722700c
Sales G.L., Vasconcelos F.H.L., Filho J.A. de C., Pequeno M.C.,	https://www.scopus.com/inward/record.uri?eid=2-s2.0-58149138808&partnerID=40&md5=a5c94d946e0d8eb12a5bccc1fd198f2c
Batarseh O.G., Wang Y.,	https://www.scopus.com/inward/record.uri?eid=2-s2.0-60749084411&partnerID=40&md5=46651bbcb92e9147e052b2de514a1b69
Van Der Pas J.W.G.M., Agusdinata D.B., Walker W.E., Marchau V.A.W.J.,	https://www.scopus.com/inward/record.uri?eid=2-s2.0-77952396873&partnerID=40&md5=f04514f24f5f6705841b14f80d01fbb1
Holzkämper A., Surridge B., Paetzold A., Kumar V., N. Lerner D., Maltby L., Wainwright J., W. Anderson C., Harris R.,	https://www.scopus.com/inward/record.uri?eid=2-s2.0-84858308718&partnerID=40&md5=ce991ec6d56983e64f2c0a3077e70349
Staniswalis J.G.,	https://www.scopus.com/inward/record.uri?eid=2-s2.0-56049108588&partnerID=40&md5=d14f29e1889bb4d06000a383d04055ee
Beven K.,	https://www.scopus.com/inward/record.uri?eid=2-s2.0-55849095132&partnerID=40&md5=e7f5b4e45457270ddcbb90d7e85bcad5
Bader B.W., Puretskiy A.A., Berry M.W.,	https://www.scopus.com/inward/record.uri?eid=2-s2.0-55349085476&partnerID=40&md5=60e0650dbda56e89b298dedc75659c4b
Wisz M.S., Hijmans R.J., Li J., Peterson A.T., Graham C.H., Guisan A., Elith J., Dudík M., Ferrier S., Huettmann F., Leathwick J.R., Lehmann A., Lohmann L., Loiselle B.A., Manion G., Moritz C., Nakamura M., Nakazawa Y., Overton J.McC., Phillips S.J., Richardson K.S., Scachetti-Pereira R., Schapire R.E., Soberón J., Williams S.E., Zimmermann N.E.,	https://www.scopus.com/inward/record.uri?eid=2-s2.0-49249098476&partnerID=40&md5=d854f8f571f3ef9c58d4c9253ec40a13
Quinn P.F., Hewett C.J.M., Dayawansa N.D.K.,	https://www.scopus.com/inward/record.uri?eid=2-s2.0-48649092005&partnerID=40&md5=754068b0d054a61fef28ba7c026b75dd
Duncan S.J., Paredis C.J.J., Bras B.,	https://www.scopus.com/inward/record.uri?eid=2-s2.0-44349179867&partnerID=40&md5=91a6244af9d3b23467222998c23ac9d5
Assavapokee T., Realff M.J., Ammons J.C.,	https://www.scopus.com/inward/record.uri?eid=2-s2.0-42449139639&partnerID=40&md5=e72c3cb1dd1900437fefc45e8206325d
Stirling A.,	https://www.scopus.com/inward/record.uri?eid=2-s2.0-43249124624&partnerID=40&md5=bed852107b8b90f5296b3b6e238770e4
Perry G.L.W., Millington J.D.A.,	https://www.scopus.com/inward/record.uri?eid=2-s2.0-38849088066&partnerID=40&md5=c49a401f10271b92cf16fd1237856b14
Zarghami M., Szidarovszky F., Ardakanian R.,	https://www.scopus.com/inward/record.uri?eid=2-s2.0-39549088103&partnerID=40&md5=bf64683b623554ad8848829074521180
[No author name available],	https://www.scopus.com/inward/record.uri?eid=2-s2.0-84889765103&partnerID=40&md5=8e278af4bf98f1f43dcd353c366e8829
Van Der Pas J.W.G.M., Agusdinata D.B., Walker W.E., Marchau V.A.J.W.,	https://www.scopus.com/inward/record.uri?eid=2-s2.0-84893522915&partnerID=40&md5=1eb2f145378f2c56b1d487827f159253
Pennington D.D.,	https://www.scopus.com/inward/record.uri?eid=2-s2.0-36349026995&partnerID=40&md5=5c2618df98caac5844962f7d2bd11a3a
Agusdinata D.B., Dittmar L.,	https://www.scopus.com/inward/record.uri?eid=2-s2.0-47349115736&partnerID=40&md5=588d906e44858873afe1ba2edc9ee01c
Khodayar M.E., Ehsan M., Rahimikian A., Kamalinia S., Abbasi E.,	https://www.scopus.com/inward/record.uri?eid=2-s2.0-48349131760&partnerID=40&md5=63a16c0fb33b2b379065b33ad50bc951
Reilly W.S.N., Guarino S.L., Kellihan B.,	https://www.scopus.com/inward/record.uri?eid=2-s2.0-49749120613&partnerID=40&md5=b6742fdebef95374460d73920b3dc2ef
Samaniego L., Bárdossy A.,	https://www.scopus.com/inward/record.uri?eid=2-s2.0-55849131118&partnerID=40&md5=1ea7f079406b1b359f3737b9e1ce292e
Al-Mamory S.O., Hong L.Z.,	https://www.scopus.com/inward/record.uri?eid=2-s2.0-48349122631&partnerID=40&md5=584534473c164698f6743e68ae3b8188
[No author name available],	https://www.scopus.com/inward/record.uri?eid=2-s2.0-47249103464&partnerID=40&md5=d5d85560400ad0cad8df63e91430798d
Goerger N.C., Goerger S.R., Griffin G.C., Teague E., Richmond P.W.,	https://www.scopus.com/inward/record.uri?eid=2-s2.0-84867795378&partnerID=40&md5=31186826bf8f8d7562f98a81c121640e
Lobo T.P., Cárcel G.H.,	https://www.scopus.com/inward/record.uri?eid=2-s2.0-56849104175&partnerID=40&md5=4eee66c91b623f45004c08716f77e666
Seliger G., Hecht M., Severengiz S., Mängel C.,	https://www.scopus.com/inward/record.uri?eid=2-s2.0-37749012090&partnerID=40&md5=694e12258aa7cb9db1afebe7cb106631
Lu Y., Wang X., Tang J.,	https://www.scopus.com/inward/record.uri?eid=2-s2.0-35548973441&partnerID=40&md5=72c1af23378a3b27c63f437f78f99e52
MacKinnon R.J.,	https://www.scopus.com/inward/record.uri?eid=2-s2.0-34548356969&partnerID=40&md5=dadd3cc04690696a8bda5c3e5f9aab52
Lempert R.J., Collins M.T.,	https://www.scopus.com/inward/record.uri?eid=2-s2.0-35448997206&partnerID=40&md5=6ccd083990b00b7fa2e19dc7a3d1e682
Zhou Y., Leung H.,	https://www.scopus.com/inward/record.uri?eid=2-s2.0-34248571358&partnerID=40&md5=c1c1cf3b26533c3f0b64491254dbb87e
Alejandro Bonilla F., Kleinfelter N., Cushman J.H.,	https://www.scopus.com/inward/record.uri?eid=2-s2.0-34247172058&partnerID=40&md5=23c08cf5573c91464c8561761078ecc4
Zhou S.-P., Li Q., Wang W.-P.,	https://www.scopus.com/inward/record.uri?eid=2-s2.0-34248674011&partnerID=40&md5=f7c8788db6eff00988ff153258d94e23
Groves D.G., Lempert R.J.,	https://www.scopus.com/inward/record.uri?eid=2-s2.0-33846838684&partnerID=40&md5=1df6e3e91c165d86dafecc1aba9029ed
Kwon S., Narayanan S.,	https://www.scopus.com/inward/record.uri?eid=2-s2.0-33750470047&partnerID=40&md5=226eac3a68d75219c2d778cdc0eb8aa2
Di Domenica N., Mitra G., Valente P., Birbilis G.,	https://www.scopus.com/inward/record.uri?eid=2-s2.0-33845863445&partnerID=40&md5=c7d149dae469bcabd94582e290a844c4
French J.,	https://www.scopus.com/inward/record.uri?eid=2-s2.0-33751530889&partnerID=40&md5=b77d2779aa63e7c17aadae31b1e60e7c
McKenna B., Gualtieri J., Elm W.,	https://www.scopus.com/inward/record.uri?eid=2-s2.0-84878806975&partnerID=40&md5=5fd1ab9d48a71ff0d1b8d39b4aa2820e
Duncan S.J., Aughenbaugh J.M., Paredis C.J.J., Bras B.,	https://www.scopus.com/inward/record.uri?eid=2-s2.0-33751331386&partnerID=40&md5=67de8bf162c124f0e938fbbb58bfcf1c
Cunningham S.W., De Haan A.R.C.,	https://www.scopus.com/inward/record.uri?eid=2-s2.0-33750453755&partnerID=40&md5=c41bfe0af67620ce3e4603903349923a
Hall J., Dawson R., Manning L., Walkden M., Dickson M., Sayers P.,	https://www.scopus.com/inward/record.uri?eid=2-s2.0-33750726083&partnerID=40&md5=0c5ca20f1bdcea5900b3e559a41c3a10
Davis P.K.,	https://www.scopus.com/inward/record.uri?eid=2-s2.0-33747367514&partnerID=40&md5=452a47ddfc96741959ed8d6b85c113ec
Djordjevic N., Morrison R.,	https://www.scopus.com/inward/record.uri?eid=2-s2.0-33747361015&partnerID=40&md5=c7bb4d8a521272915ed02d1e6a63bbda
Wahl S.A., Haunschild M.D., Oldiges M., Wiechert W.,	https://www.scopus.com/inward/record.uri?eid=2-s2.0-33746623003&partnerID=40&md5=6b07fdd90a7d3b9ca2e5edabfd498a11
Lempert R.J., Groves D.G., Popper S.W., Bankes S.C.,	https://www.scopus.com/inward/record.uri?eid=2-s2.0-33645811102&partnerID=40&md5=0e9a96e0c4c21dc5dee4d4fd830e76fe
Janoušek V., Kironský E.,	https://www.scopus.com/inward/record.uri?eid=2-s2.0-70749143209&partnerID=40&md5=bf0aeb3aadbb373fbdfe9e1c2109b755
Genus A., Coles A.-M.,	https://www.scopus.com/inward/record.uri?eid=2-s2.0-31344449858&partnerID=40&md5=1af26a263cea09f945b940b8c78a5e3d
Yannou B., Awedikian R.,	https://www.scopus.com/inward/record.uri?eid=2-s2.0-33244457274&partnerID=40&md5=130a2f365b93e690e69e65123faaa002
Veres S.M.,	https://www.scopus.com/inward/record.uri?eid=2-s2.0-79960732287&partnerID=40&md5=be0fed1391dbf613c1683a3da8514d39
Grundy C.L., Bond A., Watts L.G., Whitton J., Paulley A.,	https://www.scopus.com/inward/record.uri?eid=2-s2.0-33646553910&partnerID=40&md5=27514b4be47b0a04f4ba77828eddb03b
Hu H., Somiari S.B., Copper J., Everly R.D., Heckman C., Jordan R., Somiari R., Hooke J., Shriver C.D., Liebman M.N.,	https://www.scopus.com/inward/record.uri?eid=2-s2.0-26844522859&partnerID=40&md5=ea16b685b8aaa3e5125a5dc9a861d037
Clifford D.B., Evans S.R., Yang Y., Gulick R.M.,	https://www.scopus.com/inward/record.uri?eid=2-s2.0-27944476851&partnerID=40&md5=3f5062e7541f2e1672cab12298405e46
Mitra S., Washington S., Dumbaugh E., Meyer M.D.,	https://www.scopus.com/inward/record.uri?eid=2-s2.0-24944498390&partnerID=40&md5=51d509a3beac1715f00dcbf66ebba9ee
Regan H.M., Ben-Haim Y., Langford B., Wilson W.G., Lundberg P., Andelman S.J., Burgman M.A.,	https://www.scopus.com/inward/record.uri?eid=2-s2.0-23044493930&partnerID=40&md5=8cd3767266c3e5f4039df8e7b8f34f65
Nikkilä J., Roos C., Savia E., Kaski S.,	https://www.scopus.com/inward/record.uri?eid=2-s2.0-33644634187&partnerID=40&md5=60d761e9c3e7ab64cec5158fd2bcacc2
Doeschl-Wilson A.B., Ashmore P.E.,	https://www.scopus.com/inward/record.uri?eid=2-s2.0-19944410204&partnerID=40&md5=a0342311e83417920002aa268aef5062
Popper S.W., Lempert R.J., Bankes S.C.,	https://www.scopus.com/inward/record.uri?eid=2-s2.0-17044362640&partnerID=40&md5=3cb48d06cade4229c17094d29599c608
Gurnani A.P., Lewis K.,	https://www.scopus.com/inward/record.uri?eid=2-s2.0-20344385278&partnerID=40&md5=c609205826845bc033b3207271c223c1
Trojani F., Vanini P.,	https://www.scopus.com/inward/record.uri?eid=2-s2.0-5444275807&partnerID=40&md5=b4f82dd98e6e1173267c05b98527307e
Lim H.-W., Yun J.-E., Jang H.-M., Chai Y.-G., Yoo S.-I., Zhang B.-T.,	https://www.scopus.com/inward/record.uri?eid=2-s2.0-33645585834&partnerID=40&md5=fbd20d5ae3cf10ef62471274dddbe04f
Isnandar S., Ozveren C.S.,	https://www.scopus.com/inward/record.uri?eid=2-s2.0-1442303268&partnerID=40&md5=bf9d3ac6570189289a55708bd3f04730
Rose J.R., Turkett W.H., Huhns M.N., Roy S.S.,	https://www.scopus.com/inward/record.uri?eid=2-s2.0-7044285810&partnerID=40&md5=64f6c81446832f0f88150d50509ab09f
Veres S.M.,	https://www.scopus.com/inward/record.uri?eid=2-s2.0-1542349291&partnerID=40&md5=e2f597773c49beffef4fc70a8274a0b3
Auer M., Tschurtschenthaler T., Biffl S.,	https://www.scopus.com/inward/record.uri?eid=2-s2.0-84889587125&partnerID=40&md5=c1aea1f6db89949022459acfd4db4453
Sengul H., Barmada M.M.,	https://www.scopus.com/inward/record.uri?eid=2-s2.0-34248645397&partnerID=40&md5=28de56633d5ad8bb32f4e6847cc8b105
Lynch J.C., Brannon J.M., Hatfield K., Delfino J.J.,	https://www.scopus.com/inward/record.uri?eid=2-s2.0-0142057059&partnerID=40&md5=1d50e2dcb46e123f6cb4b1b839f9feb3
Redahan S., Lagerström L.,	https://www.scopus.com/inward/record.uri?eid=2-s2.0-0642369922&partnerID=40&md5=2659ddd4ede2e32b410ad44b6e395fc7
Unwin A., Volinsky C., Winkler S.,	https://www.scopus.com/inward/record.uri?eid=2-s2.0-0041562479&partnerID=40&md5=79f162e9152c5265d57ab7ea2eed3fc5
Craft L.L., Magyar T.M., Becker B.J., Feltz D.L.,	https://www.scopus.com/inward/record.uri?eid=2-s2.0-0037225336&partnerID=40&md5=87e689594fffe0e290f8dddf988502e9
Arellano-Garcia H., Martini W., Wendt M., Und P.L., Wozny G.,	https://www.scopus.com/inward/record.uri?eid=2-s2.0-1442334636&partnerID=40&md5=5debce38670e4ee23bc1d5eff749fb7c
Bissantz N., Munk A., Scholz A.,	https://www.scopus.com/inward/record.uri?eid=2-s2.0-0142074226&partnerID=40&md5=18b4d09496ae5aada17060c26779909f
Jablonowski M.,	https://www.scopus.com/inward/record.uri?eid=2-s2.0-84944745417&partnerID=40&md5=880847b533bb7ea2403985a2ad804eea
Minns C.K., Moore J.E.,	https://www.scopus.com/inward/record.uri?eid=2-s2.0-0037226273&partnerID=40&md5=d6e101f830baedfa12c3b2dd78154f5a
Bankes S., Lempert R., Popper S.,	https://www.scopus.com/inward/record.uri?eid=2-s2.0-0036433572&partnerID=40&md5=00bec13e843d7e449c10df48d85309c0
Baas A.C.W.,	https://www.scopus.com/inward/record.uri?eid=2-s2.0-0036836553&partnerID=40&md5=199432b84c96ad2cb992c48e816cefa4
Karsak E.E.,	https://www.scopus.com/inward/record.uri?eid=2-s2.0-0037056084&partnerID=40&md5=d67edc2e50e4c74d018048a61a65b1ed
Tennenholtz M.,	https://www.scopus.com/inward/record.uri?eid=2-s2.0-0242550408&partnerID=40&md5=28dec1a900125ca2d481756da5e6958f
Trojani F., Vanini P.,	https://www.scopus.com/inward/record.uri?eid=2-s2.0-5444254846&partnerID=40&md5=d77f5b2086604961dda7ba436d82308a
Crain T.P., Bishop R.H., Ely T.A.,	https://www.scopus.com/inward/record.uri?eid=2-s2.0-0036493899&partnerID=40&md5=250e9fe2dc69b84567024711912f3265
Richardson K.A.,	https://www.scopus.com/inward/record.uri?eid=2-s2.0-2942528909&partnerID=40&md5=e7f91116546916accc3bce2fc316d667
Flüeler T.,	https://www.scopus.com/inward/record.uri?eid=2-s2.0-0035703184&partnerID=40&md5=d4231efbe1d23b0e3238d32f14ea93b1
Faranda W.T.,	https://www.scopus.com/inward/record.uri?eid=2-s2.0-0035540726&partnerID=40&md5=0d8a5ea1e9855efe97d912e8f127d772
Ullman D.G.,	https://www.scopus.com/inward/record.uri?eid=2-s2.0-0035294735&partnerID=40&md5=915ab5542642d04c337ac9b7ebf4b97d
Hamarneh G.,	https://www.scopus.com/inward/record.uri?eid=2-s2.0-0034755701&partnerID=40&md5=e608f4d8f8d725579263c5a6d9c49537
Ramasesh R., Kulkarni S., Jayakumar M.,	https://www.scopus.com/inward/record.uri?eid=2-s2.0-0035210439&partnerID=40&md5=87dede780263a6af4cb65b6d68421452
Braglia M., Gabbrielli R.,	https://www.scopus.com/inward/record.uri?eid=2-s2.0-0034672918&partnerID=40&md5=c7696908dd8811145bf882cb7b4c7e93
Grain T., Bishop R.H., Ely T.A.,	https://www.scopus.com/inward/record.uri?eid=2-s2.0-84894460008&partnerID=40&md5=5773b8264d83427157a00316accf1d7c
Karsak E.Ertugrul,	https://www.scopus.com/inward/record.uri?eid=2-s2.0-0033714923&partnerID=40&md5=b2544c937695d38a6b74a70097a89af5
Karsak E.E.,	https://www.scopus.com/inward/record.uri?eid=2-s2.0-84951991702&partnerID=40&md5=40f0df93b69596ff80c7d925bdda2f52
Jones B., Dale R.G.,	https://www.scopus.com/inward/record.uri?eid=2-s2.0-0032708602&partnerID=40&md5=d9508d22c2a33fd2c37c0cb0cddcb266
Diaz M.P., Hubeny I.,	https://www.scopus.com/inward/record.uri?eid=2-s2.0-0038933159&partnerID=40&md5=0542d7c2b6f667915e398e5ef01cb261
Andersson C.A., Henrion R.,	https://www.scopus.com/inward/record.uri?eid=2-s2.0-0038705517&partnerID=40&md5=961b8757030ee0fc2782ce5d8c969491
Buznikov A.A., Gorokhov V.L., Logachev Ya.V., Andreev M.V.,	https://www.scopus.com/inward/record.uri?eid=2-s2.0-0032606215&partnerID=40&md5=48c5bfde07681ce19d2c52e78636e1ef
Ryan B.,	https://www.scopus.com/inward/record.uri?eid=2-s2.0-0032330584&partnerID=40&md5=07c1ac426d15ef190422fb7c5566a6fb
[No author name available],	https://www.scopus.com/inward/record.uri?eid=2-s2.0-84890539975&partnerID=40&md5=9668645e5c4a985ef8465b5ee20fc17d
Bankes S.,	https://www.scopus.com/inward/record.uri?eid=2-s2.0-84947778701&partnerID=40&md5=db2a018f60676848d99a8a021895390d
Bankes Steve,	https://www.scopus.com/inward/record.uri?eid=2-s2.0-0031634457&partnerID=40&md5=cf325bd336e85615245c75a46ff4e7c4
